{
  "software_full_name": "【待申请人确认：软件全称】",
  "software_short_name": "【待申请人确认：软件简称】",
  "version": "V1.0",
  "rightsholder": "【待申请人确认：著作权人】",
  "completion_date": "【待申请人确认：完成日期】",
  "publication_status": "pending_confirmation",
  "development_mode": "independent",
  "rights_scope": "all",
  "project_root": "PROJECT_ROOT",
  "confirmed_by": "",
  "confirmed_at": ""
}
